{
    "schema": "https://github.com/SignerPHP/pdf-signing-qualification/blob/main/schemas/v1/regression.schema.json",
    "id": "hybrid-xref",
    "description": "Signing a hybrid-reference file whose page tree is reachable only through the cross-reference stream named by /XRefStm",
    "origin": {
        "issue_url": "https://github.com/SignerPHP/signer-php/issues/24"
    },
    "scenario_id": "basic-invisible-sha256",
    "input": {
        "kind": "synthetic",
        "generator": "tests/Fixtures/Synthetic/HybridXrefPdf.php",
        "sha256": "d1ecc4e4aa7b5fd6ef5ed4eed7ac32c81ce426b44169de33d32c8366e56112bd",
        "byte_size": 721
    },
    "condition": "The trailer of the revision added by the signature keeps the /XRefStm of the original revision, so it points to a cross-reference stream that does not belong to the new section"
}
